TP_FUNDO;CNPJ_FUNDO;DENOM_SOCIAL;DT_REG;SIT;RAZAO_SOCIAL;CODIGO;TICKER;COMPANY_ID;QUOTAS;ISIN;YEAR_DIV_AVERAGE;PRICE_MARKET;VOLUME
F.I.I.;13.873.457/0001-52;AESAPAR FUNDO DE INVESTIMENTO IMOBIILÁRIO - FII;2011-12-09;EM FUNCIONAMENTO NORMAL;AESAPAR FDO INV IMOB - FII;AEFI;AEFI11.SA;13.873.457/0001-52;752500;BRAEFICTF002;1.22;171.5;780
F.I.I.;28.737.771/0001-85;ALIANZA TRUST RENDA IMOBILIARIA - FUNDO DE INVESTIMENTO IMOBILIARIO;2017-10-20;EM FUNCIONAMENTO NORMAL;ALIANZA TRUST RENDA IMOBILIARIA FDO INV IMOB;ALZR;ALZR11.SA;28.737.771/0001-85;997042;BRALZRCTF006;0.64;96.0;6763
F.I.I.;14.069.202/0001-02;AQ3 RENDA FUNDO DE INVESTIMENTO IMOBILIÁRIO;2012-07-27;EM FUNCIONAMENTO NORMAL;AQ3 RENDA FDO INV IMOB - FII;ARFI;ARFI11B.SA;14.069.202/0001-02;113816;;;0.0;0
F.I.I.;13.555.918/0001-49;AQUILLA FUNDO DE INVESTIMENTO IMOBILIÁRIO;2011-08-15;EM FUNCIONAMENTO NORMAL;ÁQUILLA FDO INV IMOB - FII;AQLL;AQLL11.SA;13.555.918/0001-49;97934;;;415.01;0
F.I.I.;22.219.335/0001-38;BANESTES RECEBIVEIS IMOBILIARIOS FUNDO DE INVESTIMENTO IMOBILIARIO;2015-06-30;EM FUNCIONAMENTO NORMAL;BANESTES RECEBÍVEIS IMOBILIÁRIOS FDO INV IMOB FII;BCRI;BCRI11.SA;22.219.335/0001-38;1210001;BRBCRICTF009;0.9;116.39;5394
F.I.I.;15.570.431/0001-60;BANRISUL NOVAS FRONTEIRAS FUNDO DE INVESTIMENTO IMOBILIARIO - FII;2012-09-11;EM FUNCIONAMENTO NORMAL;BANRISUL NOVAS FRONTEIRAS FDO INV IMOB - FII;BNFS;BNFS11.SA;15.570.431/0001-60;700000;BRBNFSCTF000;0.82;119.0;665
F.I.I.;07.000.400/0001-46;BB FUNDO DE INVESTIMENTO IMOBILIARIO PROGRESSIVO;2004-09-03;EM FUNCIONAMENTO NORMAL;BB FDO INV IMOB PROGRESSIVO;BBFI;BBFI11B.SA;07.000.400/0001-46;130000;BRBBFICTF006;23.59;2379.0;77
F.I.I.;14.410.722/0001-29;BB PROGRESSIVO II FUNDO DE INVESTIMENTO IMOBILIÁRIO - FII;2012-08-23;EM FUNCIONAMENTO NORMAL;BB PROGRESSIVO II FDO INV IMOB - FII;BBPO;BBPO11.SA;14.410.722/0001-29;15919690;BRBBPOCTF003;1.01;138.95;23242
F.I.I.;20.716.161/0001-93;BB RECEBÍVEIS IMOBILIÁRIOS FUNDO DE INVESTIMENTO IMOBILIÁRIO - FII;2014-09-12;EM FUNCIONAMENTO NORMAL;BB RECEBIVEIS IMOBILIARIOS FDO INV IMOB - FII;BBIM;BBIM11.SA;20.716.161/0001-93;1035000;BRBBIMCTF002;0.76;0.0;0
F.I.I.;12.681.340/0001-04;BB RENDA CORPORATIVA FUNDO DE INVESTIMENTO IMOBILIÁRIO - FII;2011-06-13;EM FUNCIONAMENTO NORMAL;BB RENDA CORPORATIVA FDO INV IMOB - FII;BBRC;BBRC11.SA;12.681.340/0001-04;1590000;BRBBRCCTF004;0.91;133.59;816
F.I.I.;15.394.563/0001-89;BB RENDA DE PAPÉIS IMOBILIÁRIOS FUNDO DE INVESTIMENTO IMOBILIÁRIO - FII;2012-05-07;EM FUNCIONAMENTO NORMAL;BB RENDA DE PAPÉIS IMOBILIÁRIOS FDO INV IMOB - FII;RNDP;RNDP11.SA;15.394.563/0001-89;107481;BRRNDPCTF007;5.12;955.0;5
F.I.I.;23.120.027/0001-13;BB RENDA DE PAPÉIS IMOBILIÁRIOS II FUNDO DE INVESTIMENTO IMOBILIÁRIO - FII;2017-12-28;EM FUNCIONAMENTO NORMAL;BB RENDA DE PAPEIS IMOB II FDO INV IMOB - FII;RDPD;RDPD11.SA;23.120.027/0001-13;1078042;BRRDPDCTF008;0.42;84.7;26
F.I.I.;20.216.935/0001-17;BRADESCO CARTEIRA IMOBILIÁRIA ATIVA;2015-05-19;EM FUNCIONAMENTO NORMAL;BRADESCO CARTEIRA IMOBILIÁRIA ATIVA - FII;BCIA;BCIA11.SA;20.216.935/0001-17;1689613;BRBCIACTF005;0.71;110.0;3442
F.I.I.;14.074.706/0001-02;BRAZIL REALTY FUNDO DE INVESTIMENTO IMOBILIÁRIO - FII;2016-08-03;EM FUNCIONAMENTO NORMAL;BRAZIL REALTY FDO INV IMOB;BZLI;BZLI11.SA;14.074.706/0001-02;24007132;;;14.7;2
F.I.I.;14.074.706/0001-02;BRAZIL REALTY FUNDO DE INVESTIMENTO IMOBILIÁRIO - FII;2016-08-03;EM FUNCIONAMENTO NORMAL;BRAZIL REALTY FDO INV IMOB;BZLI;BZLI11.SA;14.074.706/0001-02;24007132;;;14.7;2
F.I.I.;13.584.584/0001-31;BRAZILIAN GRAVEYARD AND DEATH CARE SERVICES FUNDO DE INVESTIMENTO IMOBILIÁRIO - FII;2011-12-12;EM FUNCIONAMENTO NORMAL;BRAZILIAN GRAVEYARD DEATH CARE FDO INV IMOB - FII;CARE;CARE11.SA;13.584.584/0001-31;134764887;BRCARER23M17;0.03;1.4;2607
F.I.I.;20.748.515/0001-81;BRESCO - FUNDO DE INVESTIMENTO IMOBILIÁRIO;2016-07-13;EM FUNCIONAMENTO NORMAL;BRESCO - FDO INV IMOB;BRCO;;20.748.515/0001-81;996556;;;0.0;0
F.I.I.;17.098.794/0001-70;CAIXA RIO BRAVO FUNDO DE FUNDOS DE INVESTIMENTO IMOBILIARIO - FII;2013-11-22;EM FUNCIONAMENTO NORMAL;CAIXA RIO BRAVO FUNDO DE FDO INV IMOB - FII;CXRI;CXRI11.SA;17.098.794/0001-70;157576;BRCXRICTF003;7.25;1008.0;38
F.I.I.;31.887.401/0001-39;CAIXA RIO BRAVO FUNDO DE FUNDOS DE INVESTIMENTO IMOBILIÁRIO II;2018-11-05;FASE PRÉ-OPERACIONAL;CAIXA RIO BRAVO FDO DE FDOS INV IMOB II;CRFF;;31.887.401/0001-39;2000000;;;0.0;0
F.I.I.;31.887.401/0001-39;CAIXA RIO BRAVO FUNDO DE FUNDOS DE INVESTIMENTO IMOBILIÁRIO II;2018-11-05;FASE PRÉ-OPERACIONAL;CAIXA RIO BRAVO FDO DE FDOS INV IMOB II;CRFF;;31.887.401/0001-39;2000000;;;0.0;0
F.I.I.;18.979.895/0001-13;CAPITÂNIA SECURITIES II FUNDO DE INVESTIMENTO IMOBILIÁRIO - FII;2014-08-07;EM FUNCIONAMENTO NORMAL;CAPITANIA SECURITIES II FDO INV IMOB - FII;CPTS;CPTS11B.SA;18.979.895/0001-13;1000000;BRCPTSCTF004;0.75;100.0;7828
F.I.I.;17.144.039/0001-85;CASTELLO BRANCO OFFICE PARK FUNDO DE INVESTIMENTO IMOBILIÁRIO - FII;2012-12-17;EM FUNCIONAMENTO NORMAL;CASTELLO BRANCO OFFICE PARK FDO INV IMOB - FII;CBOP;CBOP11.SA;17.144.039/0001-85;1415000;BRCBOPCTF001;0.47;71.65;3608
F.I.I.;17.143.998/0001-86;CSHG GR LOUVEIRA FUNDO DE INVESTIMENTO IMOBILIÁRIO - FII;2013-01-22;EM FUNCIONAMENTO NORMAL;CSHG GR LOUVEIRA FDO DE INV IMOB - FII;GRLV;GRLV11.SA;17.143.998/0001-86;1073530;BRGRLVCTF002;0.69;110.6;2999
F.I.I.;11.260.134/0001-68;CSHG JHSF PRIME OFFICES - FUNDO DE INVESTIMENTO IMOBILIÁRIO FII;2010-10-26;EM FUNCIONAMENTO NORMAL;CSHG JHSF PRIME OFFICES FDO INV IMOB - FII;HGJH;HGJH11.SA;11.260.134/0001-68;1650000;BRHGJHCTF006;0.77;179.0;534
F.I.I.;11.728.688/0001-47;CSHG LOGÍSTICA - FUNDO DE INVESTIMENTO IMOBILIÁRIO - FII;2010-05-06;EM FUNCIONAMENTO NORMAL;CSHG LOGÍSTICA FDO INV IMOB - FII;HGLG;HGLG11.SA;11.728.688/0001-47;7881340;BRHGLGCTF004;0.77;160.0;12694
F.I.I.;09.072.017/0001-29;CSHG REAL ESTATE - FUNDO DE INVESTIMENTO IMOBILIÁRIO - FII;2008-05-06;EM FUNCIONAMENTO NORMAL;CSHG REAL ESTATE FDO INV IMOB - FII;HGRE;HGRE11.SA;09.072.017/0001-29;7383100;BRHGRECTF006;0.76;155.67;9126
F.I.I.;11.160.521/0001-22;CSHG RECEBÍVEIS IMOBILIÁRIOS - FUNDO DE INVESTIMENTO IMOBILIÁRIO - FII;2009-12-23;EM FUNCIONAMENTO NORMAL;CSHG RECEBÍVEIS IMOBILIÁRIOS FDO INV IMOB - FII;HGCR;HGCR11.SA;11.160.521/0001-22;2596486;BRHGCRCTF000;0.51;122.9;11390
F.I.I.;29.641.226/0001-53;CSHG RENDA URBANA - FUNDO DE INVESTIMENTO IMOBILIARIO - FII;2018-02-14;EM FUNCIONAMENTO NORMAL;CSHG RENDA URBANA - FDO INV IMOB - FII;HGRU;HGRU11.SA;29.641.226/0001-53;1500000;BRHGRUCTF002;0.65;116.48;1846
F.I.I.;28.108.193/0001-18;DEL MONTE FUNDO DE INVESTIMENTO IMOBILIÁRIO;2017-07-28;EM FUNCIONAMENTO NORMAL;DEL MONTE AJAX FDO INV IMOB - FII;DLMT;;28.108.193/0001-18;7920000;;;0.0;0
F.I.I.;26.642.727/0001-66;DIAMANTE FUNDO DE INVESTIMENTO IMOBILIARIO;2017-01-06;EM FUNCIONAMENTO NORMAL;DIAMANTE FDO INV IMOB;DAMT;DAMT11B.SA;26.642.727/0001-66;71350688;;;0.0;0
F.I.I.;10.522.648/0001-81;DOVEL FII;2009-04-01;EM FUNCIONAMENTO NORMAL;DOVEL FDO INV IMOB;DOVL;DOVL11B.SA;10.522.648/0001-81;59466;BRDOVLCTF006;7.0;0.0;0
F.I.I.;24.070.076/0001-51;EVEN PERMUTA KINEA FII - FUNDO DE INVESTIMENTO IMOBILIÁRIO;2016-06-08;EM FUNCIONAMENTO NORMAL;EVEN PERMUTA KINEA FII - FDO INV IMOB;KINP;KINP11.SA;24.070.076/0001-51;7281700;;;0.0;0
F.I.I.;17.329.029/0001-14;FATOR IFIX FUNDO DE INVESTIMENTO IMOBILIÁRIO;2013-05-08;EM FUNCIONAMENTO NORMAL;FATOR IFIX FDO INV IMOB;FIXX;FIXX11.SA;17.329.029/0001-14;365972;BRFIXXCTF004;0.51;89.0;371
F.I.I.;11.664.201/0001-00;FATOR VERITA FUNDO DE INVESTIMENTO IMOBILIARIO;2011-01-31;EM FUNCIONAMENTO NORMAL;FATOR VERITA FDO INV IMOB - FII;VRTA;VRTA11.SA;11.664.201/0001-00;2241799;BRVRTACTF008;0.94;132.8;9166
F.I.I.;24.814.916/0001-43;FII - FUNDO DE INVESTIMENTO IMOBILIÁRIO NESTPAR;2016-05-23;EM FUNCIONAMENTO NORMAL;FDO INV IMOB NESTPAR - FII;NPAR;NPAR11.SA;24.814.916/0001-43;79340;BRNPARCTF003;0.87;121.81;1
F.I.I.;11.281.322/0001-72;FII - PRESIDENTE VARGAS;2010-04-30;EM FUNCIONAMENTO NORMAL;FDO INV IMOB - FII PRESIDENTE VARGAS;PRSV;PRSV11.SA;11.281.322/0001-72;195000;BRPRSVCTF008;1.42;338.1;34
F.I.I.;07.789.135/0001-27;FII ANCAR IC;2006-01-03;EM FUNCIONAMENTO NORMAL;FDO INV IMOB - FII ANCAR IC;ANCR;ANCR11B.SA;07.789.135/0001-27;451113;BRANCRCTF001;30.84;2500.0;0
F.I.I.;11.179.118/0001-45;FII ANHANGUERA EDUCACIONAL;2009-12-16;EM FUNCIONAMENTO NORMAL;FDO INV IMOB - FII ANHANGUERA EDUCACIONAL;FAED;FAED11.SA;11.179.118/0001-45;642168;BRFAEDCTF003;1.51;217.99;291
F.I.I.;10.347.985/0001-80;FII BB VOTORANTIM CIDADE JARDIM CONTINENTAL TOWER;2011-01-14;EM FUNCIONAMENTO NORMAL;FDO INV IMOB BB VOTORANTIM C JARD CONT TOWER;BBVJ;BBVJ11.SA;10.347.985/0001-80;2710000;BRBBVJCTF001;0.07;57.0;1053
F.I.I.;14.376.247/0001-11;FII BM BRASCAN LAJES CORPORATIVAS;2012-01-10;EM FUNCIONAMENTO NORMAL;FDO INV IMOB - FII BM BRASCAN LAJES CORPORATIVAS;BMLC;BMLC11B.SA;14.376.247/0001-11;998405;BRBMLCCTF004;0.36;76.25;265
F.I.I.;11.602.654/0001-01;FII CAMPUS FARIA LIMA;2010-06-08;EM FUNCIONAMENTO NORMAL;FDO INV IMOB - FII CAMPUS FARIA LIMA;FCFL;FCFL11.SA;11.602.654/0001-01;167000;BRFCFLCTF009;11.17;2066.21;23
F.I.I.;13.551.286/0001-45;FII CENESP;2011-07-19;EM FUNCIONAMENTO NORMAL;FDO INV IMOB - FII CENESP;CNES;CNES11.SA;13.551.286/0001-45;2949248;BRCNESCTF001;0.18;75.5;395
F.I.I.;04.141.645/0001-03;FII CONTINENTAL SQUARE FARIA LIMA;2000-11-22;EM FUNCIONAMENTO NORMAL;FDO INV IMOB CONTINENTAL SQUARE FARIA LIMA;FLMA;FLMA11.SA;04.141.645/0001-03;69033500;BRFLMACTF009;0.01;3.25;31511
F.I.I.;13.966.653/0001-71;FII CYRELA THERA CORPORATE;2011-12-02;EM FUNCIONAMENTO NORMAL;FDO INV IMOB - FII CYRELA THERA CORPORATE;THRA;THRA11.SA;13.966.653/0001-71;1472728;BRTHRACTF007;0.54;127.1;3350
F.I.I.;05.562.312/0001-02;FII EDIFICIO ALMIRANTE BARROSO;2003-03-17;EM FUNCIONAMENTO NORMAL;FDO INV IMOB - FII EDIFÍCIO ALMIRANTE BARROSO;FAMB;FAMB11B.SA;05.562.312/0001-02;104800;BRFAMBCTF018;32.66;2335.01;95
F.I.I.;06.175.262/0001-73;FII EDIFÍCIO OURINVEST;2004-05-05;EM FUNCIONAMENTO NORMAL;FDO INV IMOB EDIFÍCIO OURINVEST;EDFO;EDFO11B.SA;06.175.262/0001-73;236000;BREDFOCTF004;1.73;311.0;9
F.I.I.;13.022.994/0001-99;FII ELDORADO;2010-11-19;EM FUNCIONAMENTO NORMAL;FDO INV IMOB - FII ELDORADO;ELDO;ELDO11B.SA;13.022.994/0001-99;787256;BRELDOCTF002;3.02;0.0;0
F.I.I.;05.437.916/0001-27;FII EUROPAR;2002-12-10;EM FUNCIONAMENTO NORMAL;FDO INV IMOB EUROPAR;EURO;EURO11.SA;05.437.916/0001-27;383936;BREUROCTF011;0.85;154.3;52
F.I.I.;10.375.382/0001-91;FII FLORIPA SHOPPING;2009-09-21;EM FUNCIONAMENTO NORMAL;FDO INV IMOB - FII FLORIPA SHOPPING;FLRP;FLRP11.SA;10.375.382/0001-91;55691;BRFLRPCTF006;7.15;1321.5;17
F.I.I.;04.066.582/0001-60;FII HOSPITAL DA CRIANÇA;2000-10-03;EM FUNCIONAMENTO NORMAL;FDO INV IMOB - FII HOSPITAL DA CRIANÇA;HCRI;HCRI11.SA;04.066.582/0001-60;200000;BRHCRICTF006;2.35;362.11;125
F.I.I.;08.014.513/0001-63;FII HOSPITAL NOSSA SENHORA DE LOURDES;2006-04-20;EM FUNCIONAMENTO NORMAL;FDO INV IMOB - FII HOSPITAL NOSSA SRA DE LOURDES;NSLU;NSLU11.SA;08.014.513/0001-63;1144800;BRNSLUCTF008;1.59;254.95;353
F.I.I.;08.706.065/0001-69;FII HOTEL MAXINVEST;2007-02-13;EM FUNCIONAMENTO NORMAL;FDO INV IMOB - FII HOTEL MAXINVEST;HTMX;HTMX11.SA;08.706.065/0001-69;1118960;BRHTMXCTF000;0.82;154.89;1593
F.I.I.;31.964.557/0001-76;FII LOB MALLS FUNDO DE INVESTIMENTO IMOBILIARIO;2019-01-14;FASE PRÉ-OPERACIONAL;FII LOB MALLS FDO INV IMOB;LOBM;;31.964.557/0001-76;3000000;;;0.0;0
F.I.I.;11.274.415/0001-70;FII MAX RETAIL;2010-04-20;EM FUNCIONAMENTO NORMAL;FDO INV IMOB - FII MAX RETAIL;MAXR;MAXR11.SA;11.274.415/0001-70;59245;BRMAXRCTF009;14.83;1990.0;123
F.I.I.;01.633.741/0001-72;FII MEMORIAL OFFICE;1994-04-15;EM FUNCIONAMENTO NORMAL;FDO INV IMOB MEMORIAL OFFICE;FMOF;FMOF11.SA;01.633.741/0001-72;508008;BRFMOFCTF010;0.34;82.15;82
F.I.I.;10.869.155/0001-12;FII PARQUE DOM PEDRO SHOPPING CENTER;2009-06-16;EM FUNCIONAMENTO NORMAL;FDO INV IMOB - FII PARQUE D. PEDRO SHOPPING CENTER;PQDP;PQDP11.SA;10.869.155/0001-12;238477;BRPQDPCTF004;14.26;3165.05;30
F.I.I.;03.251.720/0001-18;FII PROJ AGUA BRANCA;1999-06-30;EM FUNCIONAMENTO NORMAL;FDO INV IMOB PROJETO ÁGUA BRANCA;FPAB;FPAB11.SA;03.251.720/0001-18;750000;BRFPABCTF011;2.37;357.81;172
F.I.I.;14.879.856/0001-93;FII SHOPPING JARDIM SUL;2012-07-17;EM FUNCIONAMENTO NORMAL;FDO INV IMOB - FII SHOPPING JARDIM SUL;JRDM;JRDM11.SA;14.879.856/0001-93;2392146;BRJRDMCTF002;0.47;77.0;673
F.I.I.;07.224.019/0001-60;FII SHOPPING PARQUE D PEDRO;2005-01-28;EM FUNCIONAMENTO NORMAL;FDO INV IMOB - FII SHOPPING PARQUE D. PEDRO;SHDP;SHDP11B.SA;07.224.019/0001-60;1639739;BRSHDPCTF007;6.28;0.0;0
F.I.I.;07.122.725/0001-00;FII TORRE ALMIRANTE;2004-11-19;EM FUNCIONAMENTO NORMAL;FDO INV IMOB - FII TORRE ALMIRANTE;ALMI;ALMI11.SA;07.122.725/0001-00;111177;BRALMICTF003;0.37;1414.97;79
F.I.I.;04.722.883/0001-02;FII TORRE NORTE;2001-10-10;EM FUNCIONAMENTO NORMAL;FDO INV IMOB - FII TORRE NORTE;TRNT;TRNT11.SA;04.722.883/0001-02;3935562;BRTRNTCTF013;0.55;178.0;168
F.I.I.;13.022.993/0001-44;FII VBI FL 4440;2011-05-26;EM FUNCIONAMENTO NORMAL;FDO INV IMOB VBI FL 4440 - FII;FVBI;FVBI11.SA;13.022.993/0001-44;2150000;BRFVBICTF004;0.41;128.5;4592
F.I.I.;02.027.437/0001-44;FUNDO BRASÍLIO MACHADO DE INVESTIMENTO IMOBILIÁRIO;1997-08-05;EM FUNCIONAMENTO NORMAL;FDO BRASÍLIO MACHADO DE INVESTIMENTO IMOBILIÁRIO;BMII;BMII11.SA;02.027.437/0001-44;140000;BRBMIICTF007;3.57;0.0;0
F.I.I.;30.091.444/0001-40;FUNDO DE FUNDOS DE INVESTIMENTO IMOBILIÁRIO KINEA FII;2018-05-23;EM FUNCIONAMENTO NORMAL;FUNDO DE FDO INV IMOB KINEA FII;KFOF;KFOF11.SA;30.091.444/0001-40;1317933;BRKFOFCTF006;0.38;113.75;371
F.I.I.;29.787.928/0001-40;FUNDO DE INVESTIMENTO IMOBILIARIO - BTG PACTUAL CREDITO IMOBILIARIO;2018-03-01;EM FUNCIONAMENTO NORMAL;FDO INV IMOB - BTG PACTUAL CREDITO IMOBILIARIO;BTCR;BTCR11.SA;29.787.928/0001-40;680000;BRBTCRCTF006;0.65;113.74;352
F.I.I.;17.324.357/0001-28;FUNDO DE INVESTIMENTO IMOBILIÁRIO - FII BRASIL PLURAL ABSOLUTO FUNDO DE FUNDOS;2013-04-09;EM FUNCIONAMENTO NORMAL;FDO INV IMOB BRASIL PLURAL ABSOLUTO FDO DE FUNDOS;BPFF;BPFF11.SA;17.324.357/0001-28;2668860;BRBPFFCTF002;0.65;92.0;8462
F.I.I.;08.924.783/0001-01;FUNDO DE INVESTIMENTO IMOBILIÁRIO - FII BTG PACTUAL CORPORATE OFFICE FUND;2007-07-20;EM FUNCIONAMENTO NORMAL;FDO INV IMOB - FII BTG PACTUAL CORP. OFFICE FUND;BRCR;BRCR11.SA;08.924.783/0001-01;19224537;BRBRCRCTF000;1.15;92.4;22638
F.I.I.;09.552.812/0001-14;FUNDO DE INVESTIMENTO IMOBILIÁRIO - FII BTG PACTUAL FUNDO DE CRI;2008-05-19;EM FUNCIONAMENTO NORMAL;FDO INV IMOB - FII BTG PACTUAL FUNDO DE CRI;FEXC;FEXC11.SA;09.552.812/0001-14;1461280;BRFEXCCTF007;0.79;108.0;2711
F.I.I.;11.026.627/0001-38;FUNDO DE INVESTIMENTO IMOBILIÁRIO - FII BTG PACTUAL FUNDO DE FUNDOS;2009-12-30;EM FUNCIONAMENTO NORMAL;FDO INV IMOB - FII BTG PACTUAL FUNDO DE FUNDOS;BCFF;BCFF11.SA;11.026.627/0001-38;8449360;BRBCFFCTF000;0.68;84.19;22393
F.I.I.;15.799.397/0001-09;FUNDO DE INVESTIMENTO IMOBILIARIO - FII CEO CYRELA COMMERCIAL PROPERTIES;2012-11-07;EM FUNCIONAMENTO NORMAL;FDO INV IMOB - FII CEO CYRELA COMMERC. PROPERTIES;CEOC;CEOC11.SA;15.799.397/0001-09;1815696;BRCEOCCTF003;0.54;84.9;1290
F.I.I.;15.333.306/0001-37;FUNDO DE INVESTIMENTO IMOBILIARIO - FII EDIFICIO GALERIA;2012-08-27;EM FUNCIONAMENTO NORMAL;FDO INV IMOB - FII EDIFÍCIO GALERIA;EDGA;EDGA11.SA;15.333.306/0001-37;3812055;BREDGACTF001;0.2;48.2;3894
F.I.I.;18.085.673/0001-57;FUNDO DE INVESTIMENTO IMOBILIÁRIO - FII NCH BRASIL RECEBÍVEIS IMOBILIÁRIOS;2013-10-10;EM FUNCIONAMENTO NORMAL;FDO INV IMOB - FII NCH BRASIL RECEBÍVEIS IMOB;NCHB;NCHB11.SA;18.085.673/0001-57;41000;BRNCHBCTF000;3.23;0.0;0
F.I.I.;17.025.970/0001-44;FUNDO DE INVESTIMENTO IMOBILIARIO - FII NOVO HORIZONTE;2013-09-10;EM FUNCIONAMENTO NORMAL;FDO INV IMOB - FII NOVO HORIZONTE;NVHO;NVHO11.SA;17.025.970/0001-44;41494533;BRNVHOCTF003;0.06;32.99;218
F.I.I.;14.788.492/0001-36;FUNDO DE INVESTIMENTO IMOBILIARIO - FII PATEO BANDEIRANTES;2013-01-21;EM FUNCIONAMENTO NORMAL;FDO INV IMOB - FII PATEO BANDEIRANTES;PATB;;14.788.492/0001-36;1723197;BRPATBCTF004;1.32;0.0;0
F.I.I.;29.467.977/0001-03;FUNDO DE INVESTIMENTO IMOBILIARIO - FII RBR RENDIMENTO HIGH GRADE;2018-01-30;EM FUNCIONAMENTO NORMAL;FDO INV IMOB - FII RBR RENDIMENTO HIGH GRADE;RBRR;RBRR11.SA;29.467.977/0001-03;2728868;BRRBRRCTF008;0.57;105.9;4746
F.I.I.;17.311.079/0001-74;FUNDO DE INVESTIMENTO IMOBILIARIO - FII SIA CORPORATE;2014-03-12;EM FUNCIONAMENTO NORMAL;FDO INV IMOB - FII SIA CORPORATE;SAIC;SAIC11B.SA;17.311.079/0001-74;1429830;BRSAICCTF009;0.74;66.0;1
F.I.I.;17.365.105/0001-47;FUNDO DE INVESTIMENTO IMOBILIÁRIO - FII TB OFFICE;2013-06-07;EM FUNCIONAMENTO NORMAL;FDO INV IMOB - FII TB OFFICE;TBOF;TBOF11.SA;17.365.105/0001-47;10050000;BRTBOFCTF006;0.2;82.0;7148
F.I.I.;32.274.163/0001-59;FUNDO DE INVESTIMENTO IMOBILIARIO - FII UBS (BR) OFFICE;2018-12-20;FASE PRÉ-OPERACIONAL;FDO INV IMOB - FII UBS (BR) OFFICE;RECT;;32.274.163/0001-59;4200000;;;0.0;0
F.I.I.;28.152.272/0001-26;FUNDO DE INVESTIMENTO IMOBILIÁRIO - FII UBS (BR) RECEBÍVEIS IMOBILIÁRIOS;2017-07-21;EM FUNCIONAMENTO NORMAL;FDO INV IMOB - FII UBS (BR) RECEB IMOB;UBSR;UBSR11.SA;28.152.272/0001-26;1555780;BRUBSRCTF000;0.84;104.99;10327
F.I.I.;28.152.272/0001-26;FUNDO DE INVESTIMENTO IMOBILIÁRIO - FII UBS (BR) RECEBÍVEIS IMOBILIÁRIOS;2017-07-21;EM FUNCIONAMENTO NORMAL;FDO INV IMOB - FII UBS (BR) RECEB IMOB;UBSR;UBSR11.SA;28.152.272/0001-26;1555780;BRUBSRCTF000;0.84;104.99;10327
F.I.I.;15.296.696/0001-12;FUNDO DE INVESTIMENTO IMOBILIARIO - FII VILA OLIMPIA CORPORATE;2012-08-10;EM FUNCIONAMENTO NORMAL;FDO INV IMOB - FII VILA OLÍMPIA CORPORATE;VLOL;VLOL11.SA;15.296.696/0001-12;1784828;BRVLOLCTF009;0.38;101.0;4109
F.I.I.;26.846.202/0001-42;FUNDO DE INVESTIMENTO IMOBILIÁRIO - HABITAT I;2017-01-13;EM FUNCIONAMENTO NORMAL;FDO INV IMOB HABITAT I;HBTT;HBTT11.SA;26.846.202/0001-42;66567;BRHBTTCTF001;10.9;1125.0;0
F.I.I.;30.791.386/0001-68;FUNDO DE INVESTIMENTO IMOBILIÁRIO - OURINVEST FUNDO DE FUNDOS;2019-03-28;FASE PRÉ-OPERACIONAL;FDO INV IMOB - OURINVEST FUNDO DE FUNDOS;OUFF;;30.791.386/0001-68;1000000;;;0.0;0
F.I.I.;30.629.603/0001-18;FUNDO DE INVESTIMENTO IMOBILIARIO - VBI LOGISTICO;2018-07-05;EM FUNCIONAMENTO NORMAL;FDO INV IMOB - VBI LOGÍSTICO;LVBI;LVBI11.SA;30.629.603/0001-18;3030000;BRLVBICTF002;0.53;107.34;570
F.I.I.;15.461.076/0001-91;FUNDO DE INVESTIMENTO IMOBILIÁRIO BR HOTÉIS;2012-12-18;EM FUNCIONAMENTO NORMAL;FDO INV IMOB BR HOTEIS - FII;BRHT;BRHT11B.SA;15.461.076/0001-91;1841677;;;0.0;0
F.I.I.;15.461.076/0001-91;FUNDO DE INVESTIMENTO IMOBILIÁRIO BR HOTÉIS;2012-12-18;EM FUNCIONAMENTO NORMAL;FDO INV IMOB BR HOTEIS - FII;BRHT;BRHT11B.SA;15.461.076/0001-91;1841677;;;0.0;0
F.I.I.;21.126.204/0001-43;FUNDO DE INVESTIMENTO IMOBILIÁRIO BRASIL VAREJO;2014-10-27;EM FUNCIONAMENTO NORMAL;FDO INV IMOB BRASIL VAREJO - FII;BVAR;BVAR11.SA;21.126.204/0001-43;625540;BRBVARCTF006;8.36;0.0;0
F.I.I.;10.991.914/0001-15;FUNDO DE INVESTIMENTO IMOBILIARIO CAIXA CEDAE;2010-02-22;EM FUNCIONAMENTO NORMAL;FDO INV IMOB CAIXA CEDAE;CXCE;CXCE11B.SA;10.991.914/0001-15;68518;BRCXCECTF004;18.73;2278.0;44
F.I.I.;12.887.506/0001-43;FUNDO DE INVESTIMENTO IMOBILIARIO CAIXA TRX LOGISTICA RENDA;2011-11-29;EM FUNCIONAMENTO NORMAL;FDO INV IMOB CAIXA TRX LOGÍSTICA RENDA;CXTL;CXTL11.SA;12.887.506/0001-43;53597;BRCXTLCTF003;1.05;438.0;3
F.I.I.;00.762.723/0001-28;FUNDO DE INVESTIMENTO IMOBILIÁRIO CENTRO TEXTIL INTERNACIONAL;1995-07-07;EM FUNCIONAMENTO NORMAL;FDO INV IMOB CENTRO TEXTIL INTERNACIONAL;CTXT;CTXT11.SA;00.762.723/0001-28;2594279;BRCTXTCTF014;0.09;62.13;155
F.I.I.;23.582.914/0001-03;FUNDO DE INVESTIMENTO IMOBILIÁRIO CJ - FII;2015-11-19;EM FUNCIONAMENTO NORMAL;FDO INV IMOB CJ - FII;CJFI;;23.582.914/0001-03;45009054;;;0.0;0
F.I.I.;17.007.528/0001-95;FUNDO DE INVESTIMENTO IMOBILIARIO GENERAL SEVERIANO;2016-05-04;EM FUNCIONAMENTO NORMAL;FDO INV IMOB GENERAL SEVERIANO - FII;GESE;GESE11B.SA;17.007.528/0001-95;38868;BRGESECTF001;17.4;0.0;0
F.I.I.;17.590.518/0001-25;FUNDO DE INVESTIMENTO IMOBILIÁRIO GENERAL SHOPPING ATIVO E RENDA - FII;2013-06-26;EM FUNCIONAMENTO NORMAL;FDO INV IMOB GENERAL SHOPPING ATIVO E RENDA - FII;FIGS;FIGS11.SA;17.590.518/0001-25;2591500;BRFIGSCTF009;0.83;69.0;20080
F.I.I.;01.201.140/0001-90;FUNDO DE INVESTIMENTO IMOBILIÁRIO GRAND PLAZA SHOPPING;1996-02-27;EM FUNCIONAMENTO NORMAL;FDO INV IMOB GRAND PLAZA SHOPPING;ABCP;ABCP11.SA;01.201.140/0001-90;12203833;BRABCPCTF000;0.15;106.03;6530
F.I.I.;23.740.527/0001-58;FUNDO DE INVESTIMENTO IMOBILIÁRIO GREEN TOWERS;2016-12-14;EM FUNCIONAMENTO NORMAL;FDO INV IMOB GREEN TOWERS;GTWR;;23.740.527/0001-58;1200000;BRGTWRCTF003;1.21;0.0;0
F.I.I.;28.851.767/0001-43;FUNDO DE INVESTIMENTO IMOBILIARIO HOSPITAL UNIMED SUL CAPIXABA;2017-11-09;EM FUNCIONAMENTO NORMAL;FDO INV IMOB HOSPITAL UNIMED SUL CAPIXABA;HUSC;HUSC11.SA;28.851.767/0001-43;850821;BRHUSCCTF009;0.9;175.0;4
F.I.I.;14.217.108/0001-45;FUNDO DE INVESTIMENTO IMOBILIARIO INDUSTRIAL DO BRASIL;2010-10-18;EM FUNCIONAMENTO NORMAL;FDO INV IMOB INDUSTRIAL DO BRASIL;FIIB;FIIB11.SA;14.217.108/0001-45;685000;BRFIIBCTF001;2.61;438.25;1980
F.I.I.;18.369.510/0001-04;FUNDO DE INVESTIMENTO IMOBILIÁRIO INFRA REAL ESTATE - FII;2013-10-04;EM FUNCIONAMENTO NORMAL;FDO INV IMOB INFRA REAL ESTATE - FII;FINF;FINF11.SA;18.369.510/0001-04;666420;BRFINFCTF002;0.18;0.0;0
F.I.I.;28.830.325/0001-10;FUNDO DE INVESTIMENTO IMOBILIARIO IRIDIUM RECEBIVEIS IMOBILIARIOS;2017-11-22;EM FUNCIONAMENTO NORMAL;FII IRIDIUM RECEBÍVEIS IMOBILIÁRIOS;IRDM;IRDM11.SA;28.830.325/0001-10;1868099;BRIRDMCTF004;0.61;112.69;10161
F.I.I.;13.500.306/0001-59;FUNDO DE INVESTIMENTO IMOBILIÁRIO MERCANTIL DO BRASIL - FII;2011-07-13;EM FUNCIONAMENTO NORMAL;FDO INV IMOB MERCANTIL DO BRASIL - FII;MBRF;MBRF11.SA;13.500.306/0001-59;101664;BRMBRFCTF004;8.04;1162.99;55
F.I.I.;29.216.463/0001-77;FUNDO DE INVESTIMENTO IMOBILIARIO MOGNO FUNDO DE FUNDOS;2017-12-12;EM FUNCIONAMENTO NORMAL;FDO INV IMOB MOGNO FUNDO DE FUNDOS;MGFF;MGFF11.SA;29.216.463/0001-77;1205927;BRMGFFCTF008;0.54;97.38;3478
F.I.I.;23.537.203/0001-17;FUNDO DE INVESTIMENTO IMOBILIARIO MV9 - FII;2015-11-19;EM FUNCIONAMENTO NORMAL;FDO INV IMOB MV9 - FII;MVFI;;23.537.203/0001-17;77850000;;;0.0;0
F.I.I.;28.516.650/0001-03;FUNDO DE INVESTIMENTO IMOBILIÁRIO OURINVEST CYRELA FII;2017-09-21;EM FUNCIONAMENTO NORMAL;FUNDO INV IMOB - OURINVEST CYRELA - FII;OUCY;OUCY11.SA;28.516.650/0001-03;533916;BROUCYR07M12;0.47;92.0;884
F.I.I.;13.974.819/0001-00;FUNDO DE INVESTIMENTO IMOBILIÁRIO OURINVEST LOGÍSTICA;2013-01-23;EM FUNCIONAMENTO NORMAL;FDO INV IMOB OURINVEST LOGÍSTICA;PDDA;PDDA11B.SA;13.974.819/0001-00;1061694;BRPDDACTF004;0.81;105.0;960
F.I.I.;28.693.595/0001-27;FUNDO DE INVESTIMENTO IMOBILIÁRIO OURINVEST RE I;2017-10-13;EM FUNCIONAMENTO NORMAL;FDO INV IMOB - OURINVEST RE I;WTSP;WTSP11B.SA;28.693.595/0001-27;992565;BRWTSPCTF002;0.55;78.0;27
F.I.I.;00.613.094/0001-74;FUNDO DE INVESTIMENTO IMOBILIÁRIO PANAMBY;1995-03-08;EM FUNCIONAMENTO NORMAL;FDO INV IMOB PANAMBY;PABY;PABY11.SA;00.613.094/0001-74;758400;BRPABYCTF012;0.13;23.2;13
F.I.I.;17.161.979/0001-82;FUNDO DE INVESTIMENTO IMOBILIÁRIO PEDRA NEGRA RENDA IMOBILIÁRIA;2013-01-16;EM FUNCIONAMENTO NORMAL;FDO INV IMOB PEDRA NEGRA RENDA IMOB;FPNG;FPNG11.SA;17.161.979/0001-82;636000;BRFPNGCTF005;0.83;0.0;0
F.I.I.;18.497.672/0001-10;FUNDO DE INVESTIMENTO IMOBILIARIO POLO ESTOQUE II - FII;2014-05-08;EM FUNCIONAMENTO NORMAL;FDO INV IMOB POLO ESTOQUE II - FII;ESTQ;;18.497.672/0001-10;44619577;;;0.0;0
F.I.I.;14.721.889/0001-00;FUNDO DE INVESTIMENTO IMOBILIÁRIO POLO SHOPPING INDAIATUBA;2012-12-20;EM FUNCIONAMENTO NORMAL;FDO INV IMOB POLO SHOPPING INDAIATUBA;VPSI;VPSI11.SA;14.721.889/0001-00;7849196;BRVPSICTF007;0.12;0.0;0
F.I.I.;27.529.279/0001-51;FUNDO DE INVESTIMENTO IMOBILIARIO RBR ALPHA FUNDO DE FUNDOS;2017-08-07;EM FUNCIONAMENTO NORMAL;FDO INV IMOB RBR ALPHA FUNDOS DE FUNDOS;RBRF;RBRF11.SA;27.529.279/0001-51;1623931;BRRBRFCTF003;0.63;102.0;8319
F.I.I.;30.166.700/0001-11;FUNDO DE INVESTIMENTO IMOBILIARIO RBR PRIVATE CREDITO IMOBILIARIO;2018-04-17;EM FUNCIONAMENTO NORMAL;FDO INV IMOB RBR PRIVATE CRÉDITO IMOB;FRBR;;30.166.700/0001-11;1500000;BRFRBRR02M13;0.74;0.0;0
F.I.I.;21.408.063/0001-51;FUNDO DE INVESTIMENTO IMOBILIARIO RBR PROPERTIES - FII;2014-11-11;EM FUNCIONAMENTO NORMAL;FDO INV IMOB RBR PROPERTIES - FII;RBRP;RBRP11.SA;21.408.063/0001-51;339960;BRRBRPCTF002;0.5;79.5373;0
F.I.I.;03.683.056/0001-86;FUNDO DE INVESTIMENTO IMOBILIÁRIO RIO BRAVO RENDA CORPORATIVA;2000-02-01;EM FUNCIONAMENTO NORMAL;FDO INV IMOB RIO BRAVO RENDA CORPORATIVA;FFCI;FFCI11.SA;03.683.056/0001-86;2170000;BRFFCICTF005;0.61;172.81;2148
F.I.I.;15.576.907/0001-70;FUNDO DE INVESTIMENTO IMOBILIÁRIO RIO BRAVO RENDA VAREJO - FII;2012-11-01;EM FUNCIONAMENTO NORMAL;FDO INV IMOB RIO BRAVO RENDA VAREJO - FII;AGCX;AGCX11.SA;15.576.907/0001-70;405000;BRAGCXCTF003;7.4;1209.0;106
F.I.I.;15.006.286/0001-90;FUNDO DE INVESTIMENTO IMOBILIÁRIO RIO NEGRO - FII;2012-06-04;EM FUNCIONAMENTO NORMAL;FDO INV IMOB RIO NEGRO - FII;RNGO;RNGO11.SA;15.006.286/0001-90;2676000;BRRNGOCTF003;0.5;85.48;2846
F.I.I.;15.006.286/0001-90;FUNDO DE INVESTIMENTO IMOBILIÁRIO RIO NEGRO - FII;2012-06-04;EM FUNCIONAMENTO NORMAL;FDO INV IMOB RIO NEGRO - FII;RNGO;RNGO11.SA;15.006.286/0001-90;2676000;BRRNGOCTF003;0.5;85.48;2846
F.I.I.;09.350.920/0001-04;FUNDO DE INVESTIMENTO IMOBILIÁRIO SÃO FERNANDO;2008-07-28;EM FUNCIONAMENTO NORMAL;FDO INV IMOB SÃO FERNANDO;SFND;SFND11.SA;09.350.920/0001-04;981472;BRSFNDCTF006;0.8;0.0;0
F.I.I.;12.804.013/0001-00;FUNDO DE INVESTIMENTO IMOBILIÁRIO SC 401;2012-07-10;EM FUNCIONAMENTO NORMAL;FDO INV IMOB SC 401;FISC;FISC11.SA;12.804.013/0001-00;127800;BRFISCCTF008;0.1;0.0;0
F.I.I.;16.671.412/0001-93;FUNDO DE INVESTIMENTO IMOBILIARIO SDI RIO BRAVO RENDA LOGÍSTICA - FII;2012-11-16;EM FUNCIONAMENTO NORMAL;FDO INV IMOB SDI RIO BRAVO RENDA LOGISTICA - FII;SDIL;SDIL11.SA;16.671.412/0001-93;3422972;BRSDILCTF004;0.57;108.31;3923
F.I.I.;16.671.412/0001-93;FUNDO DE INVESTIMENTO IMOBILIARIO SDI RIO BRAVO RENDA LOGÍSTICA - FII;2012-11-16;EM FUNCIONAMENTO NORMAL;FDO INV IMOB SDI RIO BRAVO RENDA LOGISTICA - FII;SDIL;SDIL11.SA;16.671.412/0001-93;3422972;BRSDILCTF004;0.57;108.31;3923
