TP_FUNDO;CNPJ_FUNDO;DENOM_SOCIAL;DT_REG;SIT;RAZAO_SOCIAL;CODIGO;TICKER;COMPANY_ID;QUOTAS;ISIN;YEAR_DIV_AVERAGE;PRICE_MARKET;VOLUME
F.I.I.;03.507.519/0001-59;FUNDO DE INVESTIMENTO IMOBILIÁRIO SHOPPING PÁTIO HIGIENOPOLIS;1999-12-21;EM FUNCIONAMENTO NORMAL;FDO INV IMOB SHOPPING PÁTIO HIGIENÓPOLIS;SHPH;SHPH11.SA;03.507.519/0001-59;608950;BRSHPHCTF008;3.71;920.0;74
F.I.I.;25.032.881/0001-53;FUNDO DE INVESTIMENTO IMOBILIÁRIO TG ATIVO REAL;2016-06-28;EM FUNCIONAMENTO NORMAL;FDO INV IMOB TG ATIVO REAL;TGAR;TGAR11.SA;25.032.881/0001-53;713404;BRTGARCTF009;0.82;125.36;9389
F.I.I.;12.948.291/0001-23;FUNDO DE INVESTIMENTO IMOBILIÁRIO THE ONE;2011-01-07;EM FUNCIONAMENTO NORMAL;FDO INV IMOB THE ONE;ONEF;ONEF11.SA;12.948.291/0001-23;911000;BRONEFCTF003;0.69;144.41;314
F.I.I.;26.395.660/0001-02;FUNDO DE INVESTIMENTO IMOBILIÁRIO TOURMALET I;2016-10-21;EM FUNCIONAMENTO NORMAL;FDO INV IMOB TOURMALET I;TORM;TORM13.SA;26.395.660/0001-02;1880850;BRTORMCTF024;0.65;0.0;0
F.I.I.;30.578.316/0001-26;FUNDO DE INVESTIMENTO IMOBILIÁRIO TOURMALET II;2018-07-26;EM FUNCIONAMENTO NORMAL;FDO INV IMOB TOURMALET II;TOUR;TOUR11.SA;30.578.316/0001-26;800000;BRTOURCTF019;3.3;0.0;0
F.I.I.;08.693.497/0001-82;FUNDO DE INVESTIMENTO IMOBILIARIO VEREDA - FII;2007-05-31;EM FUNCIONAMENTO NORMAL;FDO INV IMOB VEREDA - FII;VERE;VERE11.SA;08.693.497/0001-82;550084;BRVERECTF002;1.49;0.0;0
F.I.I.;00.332.266/0001-31;FUNDO DE INVESTIMENTO IMOBILIÁRIO VIA PARQUE SHOPPING - FII;1995-02-06;EM FUNCIONAMENTO NORMAL;FDO INV IMOB VIA PARQUE SHOPPING - FII;FVPQ;FVPQ11.SA;00.332.266/0001-31;2584398;BRFVPQCTF015;1.15;189.81;344
F.I.I.;17.854.016/0001-64;FUNDO DE INVESTIMENTO IMOBILIÁRIO VIDA NOVA - FII;2014-07-01;EM FUNCIONAMENTO NORMAL;FDO INV IMOB VIDA NOVA - FII;FIVN;FIVN11.SA;17.854.016/0001-64;9412630;;;2.99;672
F.I.I.;27.368.600/0001-63;FUNDO DE INVESTIMENTO IMOBILIÁRIO VOTORANTIM LOGÍSTICA;2017-11-16;EM FUNCIONAMENTO NORMAL;FDO INV IMOB VOTORANTIM LOGISTICA;VTLT;VTLT11.SA;27.368.600/0001-63;2115000;BRVTLTCTF001;0.74;100.9;20
F.I.I.;23.740.595/0001-17;FUNDO DE INVESTIMENTO IMOBILIÁRIO VOTORANTIM SHOPPING;2018-07-17;EM FUNCIONAMENTO NORMAL;FDO INV IMOB VOTORANTIM SHOPPING;VSHO;VSHO11.SA;23.740.595/0001-17;2098800;BRVSHOCTF002;0.66;102.1;913
F.I.I.;11.769.604/0001-13;GENERAL SHOPPING E OUTLETS DO BRASIL FUNDO DE INVESTIMENTO IMOBILIÁRIO - FII;2010-05-19;EM FUNCIONAMENTO NORMAL;GENERAL SHOP E OUTLETS DO BRASIL FDO INV IMOB - FI;GSFI;;11.769.604/0001-13;68482196;;;0.0;0
F.I.I.;26.614.291/0001-00;GGR COVEPI RENDA FUNDO DE INVESTIMENTO IMOBILIÁRIO;2017-01-11;EM FUNCIONAMENTO NORMAL;GGR COVEPI RENDA FDO INV IMOB;GGRC;GGRC11.SA;26.614.291/0001-00;6503028;BRGGRCCTF002;0.72;131.79;10134
F.I.I.;27.771.586/0001-44;GRUPO RCFA FUNDO DE INVESTIMENTO IMOBILIARIO;2017-06-13;EM FUNCIONAMENTO NORMAL;GRUPO RCFA FDO INV IMOB;RCFA;;27.771.586/0001-44;11678533;;;0.0;0
F.I.I.;14.631.148/0001-39;HAZ FUNDO DE INVESTIMENTO IMOBILIÁRIO;2012-05-31;EM FUNCIONAMENTO NORMAL;HAZ FDO INV IMOB - FII;ATCR;ATCR11.SA;14.631.148/0001-39;908046;BRATCRCTF008;0.05;0.0;0
F.I.I.;12.809.972/0001-00;HEDGE ATRIUM SHOPPING SANTO ANDRÉ FUNDO DE INVESTIMENTO IMOBILIÁRIO;2010-11-01;EM FUNCIONAMENTO NORMAL;HEDGE ATRIUM SHOPPING SANTO ANDRE FDO INV IMOB;ATSA;ATSA11.SA;12.809.972/0001-00;1715200;BRATSACTF000;0.79;111.99;3
F.I.I.;08.431.747/0001-06;HEDGE BRASIL SHOPPING FUNDO DE INVESTIMENTO IMOBILIÁRIO;2006-12-28;EM FUNCIONAMENTO NORMAL;HEDGE BRASIL SHOPPING FDO INV IMOB;HGBS;HGBS11.SA;08.431.747/0001-06;6718650;BRHGBSCTF000;1.15;252.5;7238
F.I.I.;16.929.519/0001-99;HEDGE REALTY DEVELOPMENT FUNDO DE INVESTIMENTO IMOBILIÁRIO;2017-12-29;EM FUNCIONAMENTO NORMAL;HEDGE REALTY DEVELOPMENT FDO INV IMOB;HRDF;;16.929.519/0001-99;7587125;;;0.0;0
F.I.I.;14.733.211/0001-48;HEDGE SHOPPING PRAÇA DA MOÇA FUNDO DE INVESTIMENTO IMOBILIÁRIO;2012-03-16;EM FUNCIONAMENTO NORMAL;HEDGE SHOPPING PRAÇA DA MOÇA FDO INV IMOB;HMOC;HMOC11.SA;14.733.211/0001-48;382017;BRHMOCCTF005;1.08;229.89;0
F.I.I.;16.875.388/0001-04;HEDGE TOP FOFII 2 FUNDO DE INVESTIMENTO IMOBILIÁRIO;2013-05-10;EM FUNCIONAMENTO NORMAL;HEDGE TOP FOFII 2 FDO INV IMOB;FOFT;FOFT11.SA;16.875.388/0001-04;1196040;BRFOFTCTF007;3.05;91.0;205
F.I.I.;18.307.582/0001-19;HEDGE TOP FOFII 3 FUNDO DE INVESTIMENTO IMOBILIÁRIO;2017-10-19;EM FUNCIONAMENTO NORMAL;HEDGE TOP FOFII 3 FDO INV IMOB;HFOF;HFOF11.SA;18.307.582/0001-19;2468390;BRHFOFCTF002;0.61;100.75;11595
F.I.I.;20.834.884/0001-97;HEDGE TOP FOFII FUNDO DE INVESTIMENTO IMOBILIÁRIO;2014-10-17;EM FUNCIONAMENTO NORMAL;HEDGE TOP FOFII FDO INV IMOB;TFOF;TFOF11.SA;20.834.884/0001-97;850530;BRTFOFCTF007;5.08;0.0;0
F.I.I.;16.915.868/0001-51;JHSF RIO BRAVO FAZENDA BOA VISTA CAPITAL PROTEGIDO FUNDO DE INVESTIMENTO IMOBILIARIO - FII;2013-07-22;EM FUNCIONAMENTO NORMAL;JHSF RIO BRAVO FAZENDA BOA VISTA CAP. PROT. - FII;RBBV;RBBV11.SA;16.915.868/0001-51;1254164;BRRBBVCTF004;0.48;83.0;181
F.I.I.;30.982.880/0001-00;JPP ALLOCATON MOGNO FUNDO DE INVESTIMENTO IMOBILIÁRIO;2018-12-04;EM FUNCIONAMENTO NORMAL;JPP ALLOCATION MOGNO - FDO INV IMOB;JPPA;;30.982.880/0001-00;500000;;;0.0;0
F.I.I.;17.216.625/0001-98;JPP CAPITAL FUNDO DE INVESTIMENTO IMOBILIÁRIO - FII;2013-05-03;EM FUNCIONAMENTO NORMAL;JPP CAPITAL FDO INV IMOB - FII;JPPC;JPPC11.SA;17.216.625/0001-98;55000;BRJPPCCTF001;1.83;0.0;0
F.I.I.;13.371.132/0001-71;JS REAL ESTATE MULTIGESTÃO - FII;2011-06-08;EM FUNCIONAMENTO NORMAL;JS REAL ESTATE MULTIGESTÃO - FII;JSRE;JSRE11.SA;13.371.132/0001-71;8081791;BRJSRECTF007;0.52;108.1;10041
F.I.I.;23.876.086/0001-16;JT PREV FUNDO DE INVESTIMENTO IMOBILIÁRIO D. HAB;2016-03-23;EM FUNCIONAMENTO NORMAL;JT PREV FDO INV IMOB DESENVOLVIMENTO HABITACIONAL;JTPR;JTPR11.SA;23.876.086/0001-16;214674;BRJTPRCTF001;0.51;0.0;0
F.I.I.;30.130.708/0001-28;KINEA HIGH YIELD CRI FUNDO DE INVESTIMENTO IMOBILIÁRIO - FII;2018-04-13;EM FUNCIONAMENTO NORMAL;KINEA HIGH YIELD CRI FDO INV IMOB - FII;KNHY;KNHY11.SA;30.130.708/0001-28;4000000;BRKNHYCTF005;0.47;111.0;3850
F.I.I.;14.423.780/0001-97;KINEA II REAL ESTATE EQUITY FII;2011-12-07;EM FUNCIONAMENTO NORMAL;KINEA II REAL ESTATE EQUITY FDO INV IMOB;KNRE;KNRE11.SA;14.423.780/0001-97;18547161;BRKNRECTF006;0.16;8.49;6466
F.I.I.;24.960.430/0001-13;KINEA ÍNDICES DE PREÇOS FUNDO DE INVESTIMENTO IMOBILIÁRIO - FII;2016-06-10;EM FUNCIONAMENTO NORMAL;KINEA ÍNDICES DE PREÇOS FDO INV IMOB - FII;KNIP;KNIP11.SA;24.960.430/0001-13;17450886;BRKNIPR03M14;0.68;110.65;11964
F.I.I.;12.005.956/0001-65;KINEA RENDA IMOBILIÁRIA - FII;2010-10-22;EM FUNCIONAMENTO NORMAL;KINEA RENDA IMOBILIÁRIA FDO INV IMOB - FII;KNRI;KNRI11.SA;12.005.956/0001-65;15524207;BRKNRICTF007;0.78;149.01;19859
F.I.I.;16.706.958/0001-32;KINEA RENDIMENTOS IMOBILIARIOS FUNDO DE INVESTIMENTO IMOBILIARIO - FII;2012-11-05;EM FUNCIONAMENTO NORMAL;KINEA RENDIMENTOS IMOBILIÁRIOS FDO INV IMOB - FII;KNCR;KNCR11.SA;16.706.958/0001-32;34902454;BRKNCRCTF000;0.57;103.93;22783
F.I.I.;17.209.378/0001-00;LATERES FUNDO DE INVESTIMENTO IMOBILIÁRIO - FII;2013-04-03;EM FUNCIONAMENTO NORMAL;LATERES FDO INV IMOB - FII;LATR;LATR11B.SA;17.209.378/0001-00;124104;BRLATRCTF009;16.23;0.0;0
F.I.I.;30.579.348/0001-46;MAC FUNDO DE INVESTIMENTO IMOBILIÁRIO;2018-07-27;EM FUNCIONAMENTO NORMAL;MAC FDO INV IMOB;DMAC;DMAC11.SA;30.579.348/0001-46;156108;BRDMACCTF003;7.36;783.5;7
F.I.I.;26.499.833/0001-32;MALLS BRASIL PLURAL FUNDO DE INVESTIMENTO IMOBILIÁRIO;2016-11-18;EM FUNCIONAMENTO NORMAL;MALLS BRASIL PLURAL FDO INV IMOB;MALL;MALL11.SA;26.499.833/0001-32;2636769;BRMALLCTF007;0.59;109.0;7022
F.I.I.;97.521.225/0001-25;MAXI RENDA FUNDO DE INVESTIMENTO IMOBILIARIO - FII;2012-04-13;EM FUNCIONAMENTO NORMAL;MAXI RENDA FDO INV IMOB - FII;MXRF;MXRF11.SA;97.521.225/0001-25;31482823;BRMXRFCTF008;0.07;10.84;97310
F.I.I.;16.915.968/0001-88;MERITO DESENVOLVIMENTO IMOBILIARIO I FII - FUNDO DE INVESTIMENTO IMOBILIARIO;2013-03-06;EM FUNCIONAMENTO NORMAL;MÉRITO DESENVOLVIMENTO IMOBILIÁRIO I FII - FII;MFII;MFII11.SA;16.915.968/0001-88;2002613;BRMFIICTF008;1.16;109.48;4305
F.I.I.;22.957.521/0001-74;MULTI PROPERTIES FUNDO DE INVESTIMENTO IMOBILIÁRIO - FII;2016-10-10;EM FUNCIONAMENTO NORMAL;MULTI PROPERTIES FDO INV IMOB - FII;PRTS;PRTS11.SA;22.957.521/0001-74;51727500;;;0.0;0
F.I.I.;22.459.737/0001-00;MULTI SHOPPINGS FUNDO DE INVESTIMENTO IMOBILIARIO - FII;2016-02-23;EM FUNCIONAMENTO NORMAL;MULTI SHOPPINGS FDO INV IMOB - FII;SHOP;SHOP11.SA;22.459.737/0001-00;1200000;;;0.0;0
F.I.I.;10.456.810/0001-00;MULTIGESTÃO RENDA COMERCIAL FUNDO DE INVESTIMENTO IMOBILIÁRIO - FII;2008-12-09;EM FUNCIONAMENTO NORMAL;MULTIGESTÃO RENDA COMERCIAL FDO INV IMOB - FII;DRIT;DRIT11B.SA;10.456.810/0001-00;463277;BRDRITCTF009;0.7;189.99;23
F.I.I.;22.003.469/0001-17;NOVA I - FUNDO DE INVESTIMENTO IMOBILIARIO - FII;2015-12-15;EM FUNCIONAMENTO NORMAL;NOVA I - FDO INV IMOB - FII;NVIF;NVIF11B.SA;22.003.469/0001-17;337400;BRNVIFCTF009;0.92;0.0;0
F.I.I.;01.235.622/0001-61;OPPORTUNITY FUNDO DE INVESTIMENTO IMOBILIÁRIO;1996-03-25;EM FUNCIONAMENTO NORMAL;OPPORTUNITY FDO INV IMOB;FTCE;FTCE11B.SA;01.235.622/0001-61;753397;BRFTCECTF005;37.25;0.0;0
F.I.I.;26.091.656/0001-50;OURINVEST JPP FUNDO DE INVESTIMENTO IMOBILIÁRIO- FII;2016-11-30;EM FUNCIONAMENTO NORMAL;OURINVEST JPP FDO INV IMOB - FII;OUJP;OUJP11.SA;26.091.656/0001-50;720000;BROUJPCTF006;0.82;111.75;713
F.I.I.;19.107.604/0001-60;OURO PRETO DESENVOLVIMENTO IMOBILIARIO I FUNDO DE INVESTIMENTO IMOBILIARIO - FII;2016-04-29;EM FUNCIONAMENTO NORMAL;OURO PRETO DESENV IMOB I FDO INV IMOB - FII;ORPD;ORPD11.SA;19.107.604/0001-60;290000;BRORPDCTF005;1.38;123.62;2
F.I.I.;30.048.651/0001-12;PÁTRIA EDIFÍCIOS CORPORATIVOS FUNDO DE INVESTIMENTO IMOBILIÁRIO - FII;2018-04-06;EM FUNCIONAMENTO NORMAL;PÁTRIA EDIFÍCIOS CORPORATIVOS FDO INV IMOB - FII;PATC;PATC11.SA;30.048.651/0001-12;1502052;;;95.26;4938
F.I.I.;14.056.001/0001-62;PERSONALE I FUNDO DE INVESTIMENTO IMOBILIÁRIO - FII;2011-09-27;EM FUNCIONAMENTO NORMAL;PERSONALE I FDO INV IMOB - FII;PRSN;PRSN11B.SA;14.056.001/0001-62;51699979;BRPRSNCTF005;0.03;0.0;0
F.I.I.;14.080.689/0001-16;POLO FII - FII RECEBÍVEIS IMOBILIÁRIOS I;2011-10-31;EM FUNCIONAMENTO NORMAL;POLO FDO INV IMOB - FII RECEBÍVEIS IMOBILIÁRIOS I;PLRI;PLRI11.SA;14.080.689/0001-16;954304;BRPLRICTF000;0.49;65.9;47
F.I.I.;17.156.502/0001-09;POLO FUNDO DE INVESTIMENTO IMOBILIARIO - RECEBIVEIS IMOBILIARIOS II - FII;2012-12-12;EM FUNCIONAMENTO NORMAL;POLO FDO INV IMOB - RECEBÍVEIS IMOB II - FII;PORD;PORD11.SA;17.156.502/0001-09;1000000;BRPORDCTF005;6.05;97.0;21972
F.I.I.;31.962.875/0001-06;PROLOGIS BRAZIL LOGISTICS VENTURE FUNDO DE INVESTIMENTO IMOBILIÁRIO;2018-12-06;EM FUNCIONAMENTO NORMAL;PROLOGIS BRAZIL LOGISTICS VENTURE FDO INV IMOB;PBLV;;31.962.875/0001-06;2750000;;;0.0;0
F.I.I.;11.945.604/0001-27;RB CAPITAL DESENVOLVIMENTO RESIDENCIAL II FUNDO DE INVESTIMENTO IMOBILIARIO - FII;2010-10-18;EM FUNCIONAMENTO NORMAL;RB CAPITAL DESENV. RESID. II FDO INV IMOB - FII;RBDS;RBDS11.SA;11.945.604/0001-27;126523;BRRBDSCTF006;6.17;190.88;36
F.I.I.;13.652.006/0001-95;RB CAPITAL GENERAL SHOPPING SULACAP  FII;2011-08-25;EM FUNCIONAMENTO NORMAL;RB CAPITAL GENERAL SHOP SULACAP FDO INV IMOB - FII;RBGS;RBGS11.SA;13.652.006/0001-95;1078000;BRRBGSCTF009;0.16;44.05;906
F.I.I.;08.696.175/0001-97;RB CAPITAL RENDA I FUNDO DE INVESTIMENTO IMOBILIARIO - FII;2007-03-28;EM FUNCIONAMENTO NORMAL;RB CAPITAL RENDA I FDO INV IMOB - FII;FIIP;FIIP11B.SA;08.696.175/0001-97;927162;BRFIIPCTF001;1.45;195.1;821
F.I.I.;09.006.914/0001-34;RB CAPITAL RENDA II FUNDO DE INVESTIMENTO IMOBILIÁRIO - FII;2007-09-05;EM FUNCIONAMENTO NORMAL;RB CAPITAL RENDA II FDO INV IMOB - FII;RBRD;RBRD11.SA;09.006.914/0001-34;1848383;BRRBRDCTF008;0.75;90.44;762
F.I.I.;26.511.274/0001-39;RB CAPITAL RENDIMENTOS IMOBILIARIOS FUNDO DE INVESTIMENTO IMOBILIARIO - FII;2017-11-21;EM FUNCIONAMENTO NORMAL;RB CAPITAL RENDIMENTOS IMOB FDO INV IMOB - FII;RCRI;RCRI11B.SA;26.511.274/0001-39;60014;BRRCRICTF005;7.73;0.0;0
F.I.I.;29.299.737/0001-39;RB CAPITAL TFO SITUS FUNDO DE INVESTIMENTO IMOBILIÁRIO - FII;2018-01-18;EM FUNCIONAMENTO NORMAL;RB CAPITAL TFO SITUS FDO INV IMOB - FII;RBTS;;29.299.737/0001-39;56525;;;0.0;0
F.I.I.;17.374.696/0001-19;REAG RENDA IMOBILIÁRIA - FUNDO DE INVESTIMENTO IMOBILIÁRIO - FII;2013-12-13;EM FUNCIONAMENTO NORMAL;REAG RENDA IMOBILIARIA FDO INV IMOB - FII;DOMC;DOMC11.SA;17.374.696/0001-19;244380;BRDOMCCTF004;5.33;501.0;458
F.I.I.;14.793.782/0001-78;RENDA DE ESCRITÓRIOS FUNDO DE INVESTIMENTO IMOBILIÁRIO - FII;2012-04-09;EM FUNCIONAMENTO NORMAL;RENDA DE ESCRITÓRIOS FDO INV IMOB - FII;RDES;RDES11.SA;14.793.782/0001-78;742000;BRRDESCTF000;0.26;70.46;1
F.I.I.;12.659.641/0001-31;RIO BRAVO CRÉDITO IMOBILIÁRIO I FUNDO DE INVESTIMENTO IMOBILIÁRIO;2011-08-10;EM FUNCIONAMENTO NORMAL;RIO BRAVO CRÉDITO IMOBILIÁRIO I FDO INV IMOB;RBCB;RBCB11.SA;12.659.641/0001-31;53100;BRRBCBCTF004;3.39;190.98;10
F.I.I.;15.769.670/0001-44;RIO BRAVO CRÉDITO IMOBILIÁRIO II FUNDO DE INVESTIMENTO IMOBILIÁRIO - FII;2012-12-20;EM FUNCIONAMENTO NORMAL;RIO BRAVO CRÉDITO IMOBILIÁRIO II FDO INV IMOB -FII;RBVO;RBVO11.SA;15.769.670/0001-44;515824;BRRBVOCTF007;0.41;42.23;837
F.I.I.;30.647.758/0001-87;RIO BRAVO CRÉDITO IMOBILIÁRIO IV FUNDO DE INVESTIMENTO IMOBILIÁRIO - FII;2018-07-17;FASE PRÉ-OPERACIONAL;RIO BRAVO CRÉDITO IMOB IV FDO INV IMOB - FII;RBIV;;30.647.758/0001-87;1500000;;;0.0;0
F.I.I.;16.915.840/0001-14;SANTANDER AGÊNCIAS FUNDO DE INVESTIMENTO IMOBILIÁRIO - FII;2012-12-26;EM FUNCIONAMENTO NORMAL;SANTANDER AGÊNCIAS FDO INV IMOB - FII;SAAG;SAAG11.SA;16.915.840/0001-14;5631512;BRSAAGCTF007;0.87;124.2;7990
F.I.I.;16.543.270/0001-89;SÃO DOMINGOS - FUNDO DE INVESTIMENTO IMOBILIÁRIO - FII;2014-04-09;EM FUNCIONAMENTO NORMAL;SAO DOMINGOS FDO INV IMOB - FII;FISD;FISD11.SA;16.543.270/0001-89;648776;;;0.0;0
F.I.I.;01.657.856/0001-05;SCP FII;1997-01-03;EM FUNCIONAMENTO NORMAL;FDO INV IMOB SCP;SCPF;SCPF11.SA;01.657.856/0001-05;4200000;BRSCPFCTF003;0.06;11.18;336
F.I.I.;09.326.861/0001-39;SHOPPING WEST PLAZA FUNDO DE INVESTIMENTO IMOBILIARIO;2008-01-17;EM FUNCIONAMENTO NORMAL;SHOPPING WEST PLAZA FDO INV IMOB;WPLZ;WPLZ11.SA;09.326.861/0001-39;989339;BRWPLZCTF004;0.38;80.84;222
F.I.I.;16.841.067/0001-99;SOCOPA FUNDO DE INVESTIMENTO IMOBILIÁRIO;2014-03-10;EM FUNCIONAMENTO NORMAL;SOCOPA FDO INV IMOB - FII;REIT;REIT11.SA;16.841.067/0001-99;26291;BRREITCTF007;22.11;1032.0;0
F.I.I.;15.538.445/0001-05;SP DOWNTOWN FUNDO DE INVESTIMENTO IMOBILIÁRIO - FII;2013-04-16;EM FUNCIONAMENTO NORMAL;SP DOWNTOWN FDO INV IMOB - FII;SPTW;SPTW11.SA;15.538.445/0001-05;1798000;BRSPTWCTF002;0.57;87.65;2206
F.I.I.;18.311.024/0001-27;SPA FUNDO DE INVESTIMENTO IMOBILIÁRIO;2016-06-20;EM FUNCIONAMENTO NORMAL;SPA FDO INV IMOB - FII;SPAF;SPAF11.SA;18.311.024/0001-27;11270;BRSPAFCTF007;5.19;0.0;0
F.I.I.;11.044.355/0001-07;STARX FUNDO DE INVESTIMENTO IMOBILIÁRIO - FII;2010-08-09;EM FUNCIONAMENTO NORMAL;STARX FDO INV IMOB - FII;STRX;STRX11.SA;11.044.355/0001-07;14682;BRSTRXCTF006;202.62;0.0;0
F.I.I.;17.007.443/0001-07;TRANSINC FUNDO DE INVESTIMENTO IMOBILIÁRIO - FII;2013-08-05;EM FUNCIONAMENTO NORMAL;TRANSINC FDO INV IMOB - FII;TSNC;TSNC11.SA;17.007.443/0001-07;18113;BRTSNCCTF009;30.46;0.0;0
F.I.I.;26.990.011/0001-50;TREECORP REAL ESTATE FII - I;2017-03-03;EM FUNCIONAMENTO NORMAL;TREECORP REAL ESTATE FDO INV IMOB - I;TCPF;;26.990.011/0001-50;290000;;;0.0;0
F.I.I.;15.006.267/0001-63;TRX EDIFICIOS CORPORATIVOS FUNDO DE INVESTIMENTO IMOBILIARIO - FII;2012-11-08;EM FUNCIONAMENTO NORMAL;TRX EDIFÍCIOS CORPORATIVOS FDO INV IMOB - FII;XTED;XTED11.SA;15.006.267/0001-63;1792557;BRXTEDCTF006;0.32;6.66;839
F.I.I.;11.839.593/0001-09;TRX REALTY LOGÍSTICA RENDA I FUNDO DE INVESTIMENTO IMOBILIÁRIO - FII;2010-08-06;EM FUNCIONAMENTO NORMAL;TRX REALTY LOGÍSTICA RENDA I FDO INV IMOB - FII;TRXL;TRXL11.SA;11.839.593/0001-09;1846797;BRTRXLCTF001;0.34;97.0;2144
F.I.I.;29.324.723/0001-28;V2 RENDA IMOBILIÁRIA FUNDO DE INVESTIMENTO IMOBILIÁRIO - FII;2018-11-12;FASE PRÉ-OPERACIONAL;V2 RENDA IMOBILIARIA FDO INV IMOB - FII;V2CR;;29.324.723/0001-28;800000;;;0.0;0
F.I.I.;29.852.732/0001-91;VALORA RE III FUNDO DE INVESTIMENTO IMOBILIARIO - FII;2018-03-13;EM FUNCIONAMENTO NORMAL;VALORA RE III FDO INV IMOB - FII;VGIR;VGIR11.SA;29.852.732/0001-91;1120948;BRVGIRCTF008;0.63;100.44;14368
F.I.I.;13.842.683/0001-76;VECTOR QUELUZ LAJES CORPORATIVAS FUNDO DE INVESTIMENTO IMOBILIARIO;2013-05-14;EM FUNCIONAMENTO NORMAL;VECTOR QUELUZ ATIVOS IMOB FDO INV IMOB;VLJS;VLJS11.SA;13.842.683/0001-76;58977;BRVLJSCTF020;1.25;0.0;0
F.I.I.;24.853.044/0001-22;VINCI LOGÍSTICA FUNDO DE INVESTIMENTO IMOBILIÁRIO - FII;2016-05-24;EM FUNCIONAMENTO NORMAL;VINCI LOGÍSTICA FDO INV IMOB - FII;VILG;VILG11.SA;24.853.044/0001-22;717200;BRVILGCTF001;0.54;112.99;16
F.I.I.;17.554.274/0001-25;VINCI SHOPPING CENTERS FUNDO DE INVESTIMENTO IMOBILIÁRIO - FII;2013-08-07;EM FUNCIONAMENTO NORMAL;VINCI SHOPPING CENTERS FDO INVEST IMOB - FII;VISC;VISC11.SA;17.554.274/0001-25;8160576;BRVISCR03M11;0.54;108.0;20112
F.I.I.;17.870.926/0001-30;Votorantim Securities Master Fundo de Investimento Imobiliário - FII;2018-03-14;EM FUNCIONAMENTO NORMAL;VOTORANTIM SECURITIES MASTER FDO INV IMOB - FII;VOTS;VOTS11.SA;17.870.926/0001-30;827913;BRVOTSCTF007;0.34;86.0;2
F.I.I.;16.802.320/0001-03;XP CORPORATE MACAÉ FUNDO DE INVESTIMENTO IMOBILIÁRIO - FII;2013-03-06;EM FUNCIONAMENTO NORMAL;XP CORPORATE MACAÉ FDO INV IMOB - FII;XPCM;XPCM11.SA;16.802.320/0001-03;2414570;BRXPCMCTF009;0.81;95.0;3935
F.I.I.;18.308.516/0001-63;XP HOTÉIS - FUNDO DE INVESTIMENTO IMOBILIÁRIO - FII;2016-04-19;EM FUNCIONAMENTO NORMAL;XP HOTÉIS - FDO INV IMOB - FII;VREH;;18.308.516/0001-63;530943;BRVREHR01M13;0.36;0.0;0
F.I.I.;28.516.325/0001-40;XP Industrial Fundo de Investimento Imobiliário;2018-05-21;EM FUNCIONAMENTO NORMAL;XP INDUSTRIAL FDO INV IMOB - FII;XPIN;XPIN11.SA;28.516.325/0001-40;2180089;BRXPINCTF004;0.62;120.0;5155
F.I.I.;26.502.794/0001-85;XP Log Fundo de Investimento Imobiliário - FII;2018-04-26;EM FUNCIONAMENTO NORMAL;XP LOG FDO INV IMOB - FII;XPLG;XPLG11.SA;26.502.794/0001-85;3661150;BRXPLGCTF002;0.56;101.89;16240
F.I.I.;28.757.546/0001-00;XP MALLS FUNDO DE INVESTIMENTO IMOBILIÁRIO FII;2017-10-04;EM FUNCIONAMENTO NORMAL;XP MALLS FDO INV IMOB FII;XPML;XPML11.SA;28.757.546/0001-00;9484954;BRXPMLCTF000;0.5;107.8;36823
